Chrome1: connectionState = "connected"
....
Chrome4

12:50:07.170872 IP 91.149.66.16.9728 > srs-server.8000: UDP, length 100
12:50:07.171108 IP srs-server.8000 > 91.149.66.16.9728: UDP, length 84
12:50:07.290785 IP 91.149.66.16.9728 > srs-server.8000: UDP, length 153
12:50:07.290785 IP 91.149.66.16.9728 > srs-server.8000: UDP, length 104
12:50:07.291400 IP srs-server.8000 > 91.149.66.16.9728: UDP, length 707
12:50:07.291512 IP srs-server.8000 > 91.149.66.16.9728: UDP, length 84
12:50:07.363638 IP 91.149.66.16.9728 > srs-server.8000: UDP, length 104
12:50:07.363734 IP srs-server.8000 > 91.149.66.16.9728: UDP, length 84
12:50:07.400664 IP 91.149.66.16.9728 > srs-server.8000: UDP, length 580
12:50:07.400756 IP srs-server.8000 > 91.149.66.16.9728: UDP, length 123
12:50:07.400773 IP srs-server.8000 > 91.149.66.16.9728: UDP, length 312
12:50:07.400787 IP srs-server.8000 > 91.149.66.16.9728: UDP, length 168
12:50:07.400799 IP srs-server.8000 > 91.149.66.16.9728: UDP, length 79
12:50:07.400810 IP srs-server.8000 > 91.149.66.16.9728: UDP, length 25
12:50:07.401213 IP srs-server.8000 > 91.149.66.16.9728: UDP, length 75
12:50:07.553861 IP 91.149.66.16.9728 > srs-server.8000: UDP, length 109
12:50:07.563656 IP 91.149.66.16.9728 > srs-server.8000: UDP, length 105
12:50:07.603478 IP 91.149.66.16.9728 > srs-server.8000: UDP, length 102
12:50:07.610619 IP 91.149.66.16.9728 > srs-server.8000: UDP, length 108
12:50:07.624002 IP srs-server.8000 > 91.149.66.16.9728: UDP, length 42
12:50:07.643599 IP 91.149.66.16.9728 > srs-server.8000: UDP, length 101
12:50:07.650733 IP 91.149.66.16.9728 > srs-server.8000: UDP, length 101
12:50:07.658849 IP 91.149.66.16.9728 > srs-server.8000: UDP, length 80
12:50:07.665775 IP 91.149.66.16.9728 > srs-server.8000: UDP, length 57
12:50:07.665799 IP 91.149.66.16.9728 > srs-server.8000: UDP, length 798
12:50:07.666765 IP 91.149.66.16.9728 > srs-server.8000: UDP, length 798
12:50:07.666765 IP 91.149.66.16.9728 > srs-server.8000: UDP, length 285
12:50:07.681576 IP 91.149.66.16.9728 > srs-server.8000: UDP, length 285
12:50:07.681576 IP 91.149.66.16.9728 > srs-server.8000: UDP, length 285
12:50:07.681616 IP 91.149.66.16.9728 > srs-server.8000: UDP, length 285
12:50:07.681616 IP 91.149.66.16.9728 > srs-server.8000: UDP, length 98
12:50:07.682625 IP 91.149.66.16.9728 > srs-server.8000: UDP, length 285
12:50:07.682625 IP 91.149.66.16.9728 > srs-server.8000: UDP, length 107
12:50:07.682735 IP 91.149.66.16.9728 > srs-server.8000: UDP, length 285
12:50:07.682775 IP 91.149.66.16.9728 > srs-server.8000: UDP, length 285
12:50:07.682775 IP 91.149.66.16.9728 > srs-server.8000: UDP, length 285
12:50:07.697673 IP 91.149.66.16.9728 > srs-server.8000: UDP, length 285
12:50:07.697741 IP 91.149.66.16.9728 > srs-server.8000: UDP, length 285
12:50:07.697769 IP 91.149.66.16.9728 > srs-server.8000: UDP, length 285
12:50:07.697769 IP 91.149.66.16.9728 > srs-server.8000: UDP, length 285
12:50:07.698597 IP 91.149.66.16.9728 > srs-server.8000: UDP, length 285
12:50:07.698693 IP 91.149.66.16.9728 > srs-server.8000: UDP, length 285
12:50:07.699028 IP 91.149.66.16.9728 > srs-server.8000: UDP, length 285
12:50:07.724665 IP srs-server.8000 > 91.149.66.16.9728: UDP, length 62
12:50:07.724730 IP srs-server.8000 > 91.149.66.16.9728: UDP, length 26
12:50:07.743739 IP 91.149.66.16.9728 > srs-server.8000: UDP, length 99
12:50:07.750881 IP 91.149.66.16.9728 > srs-server.8000: UDP, length 105
12:50:07.758816 IP 91.149.66.16.9728 > srs-server.8000: UDP, length 107
12:50:07.763813 IP 91.149.66.16.9728 > srs-server.8000: UDP, length 108
12:50:07.803488 IP 91.149.66.16.9728 > srs-server.8000: UDP, length 100
12:50:07.810870 IP 91.149.66.16.9728 > srs-server.8000: UDP, length 96
12:50:07.824800 IP srs-server.8000 > 91.149.66.16.9728: UDP, length 42
12:50:07.833485 IP 91.149.66.16.9728 > srs-server.8000: UDP, length 87
12:50:07.840805 IP 91.149.66.16.9728 > srs-server.8000: UDP, length 636
12:50:07.840805 IP 91.149.66.16.9728 > srs-server.8000: UDP, length 636
12:50:07.841593 IP 91.149.66.16.9728 > srs-server.8000: UDP, length 104
12:50:07.845177 IP srs-server.8000 > 91.149.66.16.9728: UDP, length 46
12:50:07.845196 IP srs-server.8000 > 91.149.66.16.9728: UDP, length 46
12:50:07.845209 IP srs-server.8000 > 91.149.66.16.9728: UDP, length 34
12:50:07.845223 IP srs-server.8000 > 91.149.66.16.9728: UDP, length 34
12:50:07.857957 IP 91.149.66.16.9728 > srs-server.8000: UDP, length 97
12:50:07.883698 IP 91.149.66.16.9728 > srs-server.8000: UDP, length 94
12:50:07.890621 IP 91.149.66.16.9728 > srs-server.8000: UDP, length 96
12:50:07.923947 IP 91.149.66.16.9728 > srs-server.8000: UDP, length 93
12:50:07.925227 IP srs-server.8000 > 91.149.66.16.9728: UDP, length 46
12:50:07.930598 IP 91.149.66.16.9728 > srs-server.8000: UDP, length 92
12:50:07.930598 IP 91.149.66.16.9728 > srs-server.8000: UDP, length 70
12:50:07.930598 IP 91.149.66.16.9728 > srs-server.8000: UDP, length 285
12:50:07.930598 IP 91.149.66.16.9728 > srs-server.8000: UDP, length 57
12:50:07.932635 IP 91.149.66.16.9728 > srs-server.8000: UDP, length 965
12:50:07.947888 IP 91.149.66.16.9728 > srs-server.8000: UDP, length 965
12:50:07.948945 IP 91.149.66.16.9728 > srs-server.8000: UDP, length 965
12:50:07.950837 IP 91.149.66.16.9728 > srs-server.8000: UDP, length 966
12:50:07.950838 IP 91.149.66.16.9728 > srs-server.8000: UDP, length 285
12:50:07.951680 IP 91.149.66.16.9728 > srs-server.8000: UDP, length 285
12:50:07.951861 IP 91.149.66.16.9728 > srs-server.8000: UDP, length 285
12:50:07.951861 IP 91.149.66.16.9728 > srs-server.8000: UDP, length 92
12:50:07.968716 IP 91.149.66.16.9728 > srs-server.8000: UDP, length 90
12:50:08.010681 IP 91.149.66.16.9728 > srs-server.8000: UDP, length 88
12:50:08.010681 IP 91.149.66.16.9728 > srs-server.8000: UDP, length 90
12:50:08.025229 IP srs-server.8000 > 91.149.66.16.9728: UDP, length 50
12:50:08.026858 IP 91.149.66.16.9728 > srs-server.8000: UDP, length 1050
12:50:08.028184 IP 91.149.66.16.9728 > srs-server.8000: UDP, length 1051
12:50:08.050549 IP 91.149.66.16.9728 > srs-server.8000: UDP, length 89
12:50:08.050549 IP 91.149.66.16.9728 > srs-server.8000: UDP, length 85
12:50:08.095829 IP 91.149.66.16.9728 > srs-server.8000: UDP, length 89
12:50:08.095961 IP 91.149.66.16.9728 > srs-server.8000: UDP, length 86
12:50:08.125466 IP srs-server.8000 > 91.149.66.16.9728: UDP, length 42
12:50:08.130552 IP 91.149.66.16.9728 > srs-server.8000: UDP, length 86
12:50:08.130553 IP 91.149.66.16.9728 > srs-server.8000: UDP, length 86
12:50:08.131770 IP 91.149.66.16.9728 > srs-server.8000: UDP, length 986
12:50:08.132880 IP 91.149.66.16.9728 > srs-server.8000: UDP, length 987
12:50:08.170753 IP 91.149.66.16.9728 > srs-server.8000: UDP, length 86
12:50:08.170753 IP 91.149.66.16.9728 > srs-server.8000: UDP, length 105
12:50:08.210742 IP 91.149.66.16.9728 > srs-server.8000: UDP, length 105
12:50:08.210770 IP 91.149.66.16.9728 > srs-server.8000: UDP, length 107
12:50:08.225616 IP srs-server.8000 > 91.149.66.16.9728: UDP, length 46
12:50:08.230645 IP 91.149.66.16.9728 > srs-server.8000: UDP, length 285
12:50:08.231766 IP 91.149.66.16.9728 > srs-server.8000: UDP, length 924
12:50:08.232853 IP 91.149.66.16.9728 > srs-server.8000: UDP, length 924
12:50:08.232853 IP 91.149.66.16.9728 > srs-server.8000: UDP, length 285
12:50:08.233899 IP 91.149.66.16.9728 > srs-server.8000: UDP, length 285
12:50:08.242799 IP 91.149.66.16.9728 > srs-server.8000: UDP, length 285
12:50:08.242799 IP 91.149.66.16.9728 > srs-server.8000: UDP, length 285
12:50:08.243751 IP 91.149.66.16.9728 > srs-server.8000: UDP, length 285
12:50:08.243751 IP 91.149.66.16.9728 > srs-server.8000: UDP, length 285
12:50:08.245652 IP 91.149.66.16.9728 > srs-server.8000: UDP, length 285
12:50:08.245652 IP 91.149.66.16.9728 > srs-server.8000: UDP, length 285
12:50:08.245652 IP 91.149.66.16.9728 > srs-server.8000: UDP, length 285
12:50:08.246558 IP 91.149.66.16.9728 > srs-server.8000: UDP, length 285
12:50:08.246558 IP 91.149.66.16.9728 > srs-server.8000: UDP, length 285
12:50:08.247433 IP 91.149.66.16.9728 > srs-server.8000: UDP, length 285
12:50:08.247460 IP 91.149.66.16.9728 > srs-server.8000: UDP, length 285
12:50:08.247524 IP 91.149.66.16.9728 > srs-server.8000: UDP, length 104
12:50:08.248566 IP 91.149.66.16.9728 > srs-server.8000: UDP, length 285
12:50:08.248594 IP 91.149.66.16.9728 > srs-server.8000: UDP, length 285
12:50:08.250377 IP 91.149.66.16.9728 > srs-server.8000: UDP, length 285
12:50:08.250405 IP 91.149.66.16.9728 > srs-server.8000: UDP, length 101
12:50:08.250406 IP 91.149.66.16.9728 > srs-server.8000: UDP, length 285
12:50:08.250406 IP 91.149.66.16.9728 > srs-server.8000: UDP, length 285
12:50:08.251453 IP 91.149.66.16.9728 > srs-server.8000: UDP, length 285
12:50:08.251481 IP 91.149.66.16.9728 > srs-server.8000: UDP, length 285
12:50:08.290537 IP 91.149.66.16.9728 > srs-server.8000: UDP, length 96
12:50:08.290537 IP 91.149.66.16.9728 > srs-server.8000: UDP, length 93
12:50:08.325767 IP srs-server.8000 > 91.149.66.16.9728: UDP, length 66
12:50:08.330655 IP 91.149.66.16.9728 > srs-server.8000: UDP, length 88
12:50:08.330655 IP 91.149.66.16.9728 > srs-server.8000: UDP, length 87
12:50:08.331517 IP 91.149.66.16.9728 > srs-server.8000: UDP, length 943
12:50:08.332576 IP 91.149.66.16.9728 > srs-server.8000: UDP, length 943
12:50:08.370522 IP 91.149.66.16.9728 > srs-server.8000: UDP, length 86
12:50:08.370522 IP 91.149.66.16.9728 > srs-server.8000: UDP, length 86
12:50:08.410389 IP 91.149.66.16.9728 > srs-server.8000: UDP, length 93
12:50:08.410390 IP 91.149.66.16.9728 > srs-server.8000: UDP, length 102
12:50:08.425896 IP srs-server.8000 > 91.149.66.16.9728: UDP, length 46
12:50:08.441355 IP 91.149.66.16.9728 > srs-server.8000: UDP, length 103
12:50:08.456426 IP 91.149.66.16.9728 > srs-server.8000: UDP, length 112
12:50:08.457577 IP 91.149.66.16.9728 > srs-server.8000: UDP, length 944
12:50:08.458470 IP 91.149.66.16.9728 > srs-server.8000: UDP, length 944
12:50:08.490417 IP 91.149.66.16.9728 > srs-server.8000: UDP, length 107
12:50:08.490418 IP 91.149.66.16.9728 > srs-server.8000: UDP, length 111
12:50:08.526160 IP srs-server.8000 > 91.149.66.16.9728: UDP, length 42
12:50:08.530534 IP 91.149.66.16.9728 > srs-server.8000: UDP, length 113
12:50:08.530534 IP 91.149.66.16.9728 > srs-server.8000: UDP, length 109
12:50:08.531643 IP 91.149.66.16.9728 > srs-server.8000: UDP, length 935
12:50:08.532318 IP 91.149.66.16.9728 > srs-server.8000: UDP, length 936
12:50:08.570505 IP 91.149.66.16.9728 > srs-server.8000: UDP, length 106
12:50:08.570505 IP 91.149.66.16.9728 > srs-server.8000: UDP, length 109
12:50:08.610489 IP 91.149.66.16.9728 > srs-server.8000: UDP, length 104
12:50:08.610489 IP 91.149.66.16.9728 > srs-server.8000: UDP, length 103
12:50:08.610522 IP 91.149.66.16.9728 > srs-server.8000: UDP, length 104
12:50:08.610581 IP srs-server.8000 > 91.149.66.16.9728: UDP, length 84
12:50:08.627413 IP srs-server.8000 > 91.149.66.16.9728: UDP, length 46
12:50:08.631477 IP 91.149.66.16.9728 > srs-server.8000: UDP, length 959
12:50:08.632555 IP 91.149.66.16.9728 > srs-server.8000: UDP, length 960
12:50:08.632555 IP 91.149.66.16.9728 > srs-server.8000: UDP, length 106
12:50:08.647287 IP 91.149.66.16.9728 > srs-server.8000: UDP, length 106
12:50:08.690546 IP 91.149.66.16.9728 > srs-server.8000: UDP, length 97
12:50:08.690546 IP 91.149.66.16.9728 > srs-server.8000: UDP, length 100
12:50:08.720634 IP 91.149.66.16.9728 > srs-server.8000: UDP, length 98
12:50:08.727625 IP srs-server.8000 > 91.149.66.16.9728: UDP, length 46
12:50:08.735715 IP 91.149.66.16.9728 > srs-server.8000: UDP, length 99
12:50:08.735836 IP 91.149.66.16.9728 > srs-server.8000: UDP, length 985
12:50:08.736527 IP 91.149.66.16.9728 > srs-server.8000: UDP, length 986
12:50:08.770480 IP 91.149.66.16.9728 > srs-server.8000: UDP, length 96
12:50:08.770480 IP 91.149.66.16.9728 > srs-server.8000: UDP, length 95
12:50:08.810536 IP 91.149.66.16.9728 > srs-server.8000: UDP, length 99
12:50:08.810536 IP 91.149.66.16.9728 > srs-server.8000: UDP, length 102
12:50:08.828577 IP srs-server.8000 > 91.149.66.16.9728: UDP, length 46
12:50:08.830687 IP 91.149.66.16.9728 > srs-server.8000: UDP, length 1002
12:50:08.831648 IP 91.149.66.16.9728 > srs-server.8000: UDP, length 1003
12:50:08.831648 IP 91.149.66.16.9728 > srs-server.8000: UDP, length 104
12:50:08.846898 IP srs-server.8000 > 91.149.66.16.9728: UDP, length 46
12:50:08.846909 IP srs-server.8000 > 91.149.66.16.9728: UDP, length 46
12:50:08.846920 IP srs-server.8000 > 91.149.66.16.9728: UDP, length 34
12:50:08.846931 IP srs-server.8000 > 91.149.66.16.9728: UDP, length 34
12:50:08.848439 IP 91.149.66.16.9728 > srs-server.8000: UDP, length 97
12:50:08.890631 IP 91.149.66.16.9728 > srs-server.8000: UDP, length 105
12:50:08.890631 IP 91.149.66.16.9728 > srs-server.8000: UDP, length 103
12:50:08.928995 IP srs-server.8000 > 91.149.66.16.9728: UDP, length 42
12:50:08.930596 IP 91.149.66.16.9728 > srs-server.8000: UDP, length 1004
12:50:08.931394 IP 91.149.66.16.9728 > srs-server.8000: UDP, length 1005
12:50:08.931394 IP 91.149.66.16.9728 > srs-server.8000: UDP, length 107
12:50:08.931394 IP 91.149.66.16.9728 > srs-server.8000: UDP, length 106
12:50:08.931394 IP 91.149.66.16.9728 > srs-server.8000: UDP, length 101
12:50:08.970487 IP 91.149.66.16.9728 > srs-server.8000: UDP, length 101
12:50:08.970487 IP 91.149.66.16.9728 > srs-server.8000: UDP, length 99
12:50:09.029986 IP srs-server.8000 > 91.149.66.16.9728: UDP, length 42
12:50:09.030538 IP 91.149.66.16.9728 > srs-server.8000: UDP, length 95
12:50:09.030538 IP 91.149.66.16.9728 > srs-server.8000: UDP, length 102
12:50:09.030682 IP 91.149.66.16.9728 > srs-server.8000: UDP, length 938
12:50:09.032590 IP 91.149.66.16.9728 > srs-server.8000: UDP, length 939
12:50:09.032590 IP 91.149.66.16.9728 > srs-server.8000: UDP, length 99
12:50:09.040491 IP 91.149.66.16.9728 > srs-server.8000: UDP, length 95
12:50:09.090535 IP 91.149.66.16.9728 > srs-server.8000: UDP, length 102
12:50:09.090562 IP 91.149.66.16.9728 > srs-server.8000: UDP, length 104
12:50:09.130469 IP 91.149.66.16.9728 > srs-server.8000: UDP, length 108
12:50:09.130568 IP srs-server.8000 > 91.149.66.16.9728: UDP, length 46
12:50:09.130638 IP 91.149.66.16.9728 > srs-server.8000: UDP, length 978
12:50:09.131450 IP 91.149.66.16.9728 > srs-server.8000: UDP, length 978
12:50:09.131450 IP 91.149.66.16.9728 > srs-server.8000: UDP, length 111
12:50:09.132418 IP 91.149.66.16.9728 > srs-server.8000: UDP, length 106
12:50:09.170452 IP 91.149.66.16.9728 > srs-server.8000: UDP, length 102
12:50:09.170453 IP 91.149.66.16.9728 > srs-server.8000: UDP, length 111
12:50:09.211644 IP 91.149.66.16.9728 > srs-server.8000: UDP, length 109
12:50:09.211675 IP 91.149.66.16.9728 > srs-server.8000: UDP, length 107
12:50:09.226721 IP 91.149.66.16.9728 > srs-server.8000: UDP, length 1036
12:50:09.231547 IP srs-server.8000 > 91.149.66.16.9728: UDP, length 46
12:50:09.244048 IP 91.149.66.16.9728 > srs-server.8000: UDP, length 1037
12:50:09.244048 IP 91.149.66.16.9728 > srs-server.8000: UDP, length 110
12:50:09.244048 IP 91.149.66.16.9728 > srs-server.8000: UDP, length 101
12:50:09.290456 IP 91.149.66.16.9728 > srs-server.8000: UDP, length 112
12:50:09.290456 IP 91.149.66.16.9728 > srs-server.8000: UDP, length 106
12:50:09.330587 IP 91.149.66.16.9728 > srs-server.8000: UDP, length 104
12:50:09.331561 IP 91.149.66.16.9728 > srs-server.8000: UDP, length 997
12:50:09.331561 IP 91.149.66.16.9728 > srs-server.8000: UDP, length 998
12:50:09.331631 IP 91.149.66.16.9728 > srs-server.8000: UDP, length 105
12:50:09.331849 IP srs-server.8000 > 91.149.66.16.9728: UDP, length 42
12:50:09.370408 IP 91.149.66.16.9728 > srs-server.8000: UDP, length 111
12:50:09.370408 IP 91.149.66.16.9728 > srs-server.8000: UDP, length 102
12:50:09.403486 IP 91.149.66.16.9728 > srs-server.8000: UDP, length 101
12:50:09.410520 IP 91.149.66.16.9728 > srs-server.8000: UDP, length 99
12:50:09.425467 IP 91.149.66.16.9728 > srs-server.8000: UDP, length 1029
12:50:09.426889 IP 91.149.66.16.9728 > srs-server.8000: UDP, length 1029
12:50:09.432267 IP srs-server.8000 > 91.149.66.16.9728: UDP, length 46
12:50:09.435422 IP 91.149.66.16.9728 > srs-server.8000: UDP, length 100
12:50:09.442530 IP 91.149.66.16.9728 > srs-server.8000: UDP, length 101
12:50:09.483652 IP 91.149.66.16.9728 > srs-server.8000: UDP, length 97
12:50:09.490429 IP 91.149.66.16.9728 > srs-server.8000: UDP, length 93
12:50:09.522602 IP 91.149.66.16.9728 > srs-server.8000: UDP, length 993
12:50:09.523651 IP 91.149.66.16.9728 > srs-server.8000: UDP, length 994
12:50:09.523651 IP 91.149.66.16.9728 > srs-server.8000: UDP, length 92
12:50:09.523651 IP 91.149.66.16.9728 > srs-server.8000: UDP, length 100
12:50:09.532919 IP srs-server.8000 > 91.149.66.16.9728: UDP, length 46
12:50:09.563434 IP 91.149.66.16.9728 > srs-server.8000: UDP, length 102
12:50:09.570516 IP 91.149.66.16.9728 > srs-server.8000: UDP, length 95
12:50:09.603618 IP 91.149.66.16.9728 > srs-server.8000: UDP, length 96
12:50:09.610419 IP 91.149.66.16.9728 > srs-server.8000: UDP, length 92
12:50:09.625883 IP 91.149.66.16.9728 > srs-server.8000: UDP, length 958
12:50:09.626632 IP 91.149.66.16.9728 > srs-server.8000: UDP, length 959
12:50:09.633942 IP srs-server.8000 > 91.149.66.16.9728: UDP, length 42
12:50:09.634705 IP 91.149.66.16.9728 > srs-server.8000: UDP, length 94
12:50:09.641501 IP 91.149.66.16.9728 > srs-server.8000: UDP, length 94
12:50:09.663462 IP 91.149.66.16.9728 > srs-server.8000: UDP, length 104
12:50:09.663628 IP srs-server.8000 > 91.149.66.16.9728: UDP, length 84
12:50:09.683449 IP 91.149.66.16.9728 > srs-server.8000: UDP, length 85
12:50:09.690527 IP 91.149.66.16.9728 > srs-server.8000: UDP, length 88
12:50:09.723601 IP 91.149.66.16.9728 > srs-server.8000: UDP, length 90
12:50:09.730610 IP 91.149.66.16.9728 > srs-server.8000: UDP, length 89
12:50:09.730667 IP 91.149.66.16.9728 > srs-server.8000: UDP, length 986
12:50:09.731498 IP 91.149.66.16.9728 > srs-server.8000: UDP, length 987
12:50:09.734196 IP srs-server.8000 > 91.149.66.16.9728: UDP, length 46
12:50:09.734328 IP srs-server.8000 > 91.149.66.16.9728: UDP, length 26
12:50:09.764446 IP 91.149.66.16.9728 > srs-server.8000: UDP, length 89
12:50:09.772575 IP 91.149.66.16.9728 > srs-server.8000: UDP, length 95
12:50:09.803304 IP 91.149.66.16.9728 > srs-server.8000: UDP, length 98
12:50:09.826511 IP 91.149.66.16.9728 > srs-server.8000: UDP, length 93
12:50:09.834250 IP srs-server.8000 > 91.149.66.16.9728: UDP, length 42
12:50:09.834780 IP 91.149.66.16.9728 > srs-server.8000: UDP, length 1011
12:50:09.835652 IP 91.149.66.16.9728 > srs-server.8000: UDP, length 1012
12:50:09.835652 IP 91.149.66.16.9728 > srs-server.8000: UDP, length 93
12:50:09.836320 IP 91.149.66.16.9728 > srs-server.8000: UDP, length 100
12:50:09.846844 IP srs-server.8000 > 91.149.66.16.9728: UDP, length 46
12:50:09.846863 IP srs-server.8000 > 91.149.66.16.9728: UDP, length 46
12:50:09.846880 IP srs-server.8000 > 91.149.66.16.9728: UDP, length 34
12:50:09.846898 IP srs-server.8000 > 91.149.66.16.9728: UDP, length 34
12:50:09.890568 IP 91.149.66.16.9728 > srs-server.8000: UDP, length 103
12:50:09.890568 IP 91.149.66.16.9728 > srs-server.8000: UDP, length 106
12:50:09.930430 IP 91.149.66.16.9728 > srs-server.8000: UDP, length 109
12:50:09.930430 IP 91.149.66.16.9728 > srs-server.8000: UDP, length 110
12:50:09.930430 IP 91.149.66.16.9728 > srs-server.8000: UDP, length 57
12:50:09.934820 IP srs-server.8000 > 91.149.66.16.9728: UDP, length 46
12:50:09.946610 IP 91.149.66.16.9728 > srs-server.8000: UDP, length 1087
12:50:09.947526 IP 91.149.66.16.9728 > srs-server.8000: UDP, length 1087
12:50:09.948560 IP 91.149.66.16.9728 > srs-server.8000: UDP, length 1088
12:50:09.963579 IP 91.149.66.16.9728 > srs-server.8000: UDP, length 110
12:50:09.963579 IP 91.149.66.16.9728 > srs-server.8000: UDP, length 100
12:50:10.010198 IP 91.149.66.16.9728 > srs-server.8000: UDP, length 102
12:50:10.010228 IP 91.149.66.16.9728 > srs-server.8000: UDP, length 108
12:50:10.026617 IP 91.149.66.16.9728 > srs-server.8000: UDP, length 1106
12:50:10.029649 IP 91.149.66.16.9728 > srs-server.8000: UDP, length 1106
12:50:10.035695 IP srs-server.8000 > 91.149.66.16.9728: UDP, length 46
12:50:10.043572 IP 91.149.66.16.9728 > srs-server.8000: UDP, length 111
12:50:10.045565 IP 91.149.66.16.9728 > srs-server.8000: UDP, length 106
12:50:10.090421 IP 91.149.66.16.9728 > srs-server.8000: UDP, length 97
12:50:10.090421 IP 91.149.66.16.9728 > srs-server.8000: UDP, length 96
12:50:10.130572 IP 91.149.66.16.9728 > srs-server.8000: UDP, length 93
12:50:10.130646 IP 91.149.66.16.9728 > srs-server.8000: UDP, length 100
12:50:10.132521 IP 91.149.66.16.9728 > srs-server.8000: UDP, length 1007
12:50:10.134728 IP 91.149.66.16.9728 > srs-server.8000: UDP, length 1007
12:50:10.135929 IP srs-server.8000 > 91.149.66.16.9728: UDP, length 46
12:50:10.170431 IP 91.149.66.16.9728 > srs-server.8000: UDP, length 96
12:50:10.170431 IP 91.149.66.16.9728 > srs-server.8000: UDP, length 97
12:50:10.200281 IP 91.149.66.16.9728 > srs-server.8000: UDP, length 94
12:50:10.208261 IP 91.149.66.16.9728 > srs-server.8000: UDP, length 95
12:50:10.231731 IP 91.149.66.16.9728 > srs-server.8000: UDP, length 1002
12:50:10.233565 IP 91.149.66.16.9728 > srs-server.8000: UDP, length 1002
12:50:10.233565 IP 91.149.66.16.9728 > srs-server.8000: UDP, length 88
12:50:10.236014 IP srs-server.8000 > 91.149.66.16.9728: UDP, length 46
12:50:10.248726 IP 91.149.66.16.9728 > srs-server.8000: UDP, length 90
12:50:10.310310 IP 91.149.66.16.9728 > srs-server.8000: UDP, length 96
12:50:10.310311 IP 91.149.66.16.9728 > srs-server.8000: UDP, length 90
12:50:10.323463 IP 91.149.66.16.9728 > srs-server.8000: UDP, length 91
12:50:10.325520 IP 91.149.66.16.9728 > srs-server.8000: UDP, length 88
12:50:10.336068 IP srs-server.8000 > 91.149.66.16.9728: UDP, length 42
12:50:10.340622 IP 91.149.66.16.9728 > srs-server.8000: UDP, length 1086
12:50:10.341762 IP 91.149.66.16.9728 > srs-server.8000: UDP, length 1087
12:50:10.370404 IP 91.149.66.16.9728 > srs-server.8000: UDP, length 88
12:50:10.370404 IP 91.149.66.16.9728 > srs-server.8000: UDP, length 86
12:50:10.410492 IP 91.149.66.16.9728 > srs-server.8000: UDP, length 84
12:50:10.410614 IP 91.149.66.16.9728 > srs-server.8000: UDP, length 88
12:50:10.425645 IP 91.149.66.16.9728 > srs-server.8000: UDP, length 1110
12:50:10.426554 IP 91.149.66.16.9728 > srs-server.8000: UDP, length 1111
12:50:10.435443 IP 91.149.66.16.9728 > srs-server.8000: UDP, length 83
12:50:10.436645 IP srs-server.8000 > 91.149.66.16.9728: UDP, length 46
12:50:10.450479 IP 91.149.66.16.9728 > srs-server.8000: UDP, length 85
12:50:10.490540 IP 91.149.66.16.9728 > srs-server.8000: UDP, length 84
12:50:10.490732 IP 91.149.66.16.9728 > srs-server.8000: UDP, length 93
12:50:10.530429 IP 91.149.66.16.9728 > srs-server.8000: UDP, length 90
12:50:10.536745 IP srs-server.8000 > 91.149.66.16.9728: UDP, length 42
12:50:10.539692 IP 91.149.66.16.9728 > srs-server.8000: UDP, length 1017
12:50:10.541586 IP 91.149.66.16.9728 > srs-server.8000: UDP, length 1017
12:50:10.541586 IP 91.149.66.16.9728 > srs-server.8000: UDP, length 95
12:50:10.570484 IP 91.149.66.16.9728 > srs-server.8000: UDP, length 96
12:50:10.570545 IP 91.149.66.16.9728 > srs-server.8000: UDP, length 96
12:50:10.610665 IP 91.149.66.16.9728 > srs-server.8000: UDP, length 114
12:50:10.610665 IP 91.149.66.16.9728 > srs-server.8000: UDP, length 111
12:50:10.625426 IP 91.149.66.16.9728 > srs-server.8000: UDP, length 1017
12:50:10.626660 IP 91.149.66.16.9728 > srs-server.8000: UDP, length 1018
12:50:10.626660 IP 91.149.66.16.9728 > srs-server.8000: UDP, length 106
12:50:10.637538 IP srs-server.8000 > 91.149.66.16.9728: UDP, length 46
12:50:10.650552 IP 91.149.66.16.9728 > srs-server.8000: UDP, length 109
12:50:10.650552 IP 91.149.66.16.9728 > srs-server.8000: UDP, length 111
12:50:10.690395 IP 91.149.66.16.9728 > srs-server.8000: UDP, length 101
12:50:10.690395 IP 91.149.66.16.9728 > srs-server.8000: UDP, length 99
12:50:10.730442 IP 91.149.66.16.9728 > srs-server.8000: UDP, length 99
12:50:10.730472 IP 91.149.66.16.9728 > srs-server.8000: UDP, length 100
12:50:10.737817 IP srs-server.8000 > 91.149.66.16.9728: UDP, length 42
12:50:10.745645 IP 91.149.66.16.9728 > srs-server.8000: UDP, length 1092
12:50:10.746529 IP 91.149.66.16.9728 > srs-server.8000: UDP, length 1093
12:50:10.761477 IP 91.149.66.16.9728 > srs-server.8000: UDP, length 99
12:50:10.776545 IP 91.149.66.16.9728 > srs-server.8000: UDP, length 105
12:50:10.810316 IP 91.149.66.16.9728 > srs-server.8000: UDP, length 105
12:50:10.810316 IP 91.149.66.16.9728 > srs-server.8000: UDP, length 100
12:50:10.825661 IP 91.149.66.16.9728 > srs-server.8000: UDP, length 1014
12:50:10.834771 IP 91.149.66.16.9728 > srs-server.8000: UDP, length 1015
12:50:10.834771 IP 91.149.66.16.9728 > srs-server.8000: UDP, length 101
12:50:10.838261 IP srs-server.8000 > 91.149.66.16.9728: UDP, length 46
12:50:10.847218 IP srs-server.8000 > 91.149.66.16.9728: UDP, length 46
12:50:10.847229 IP srs-server.8000 > 91.149.66.16.9728: UDP, length 46
12:50:10.847239 IP srs-server.8000 > 91.149.66.16.9728: UDP, length 34
12:50:10.847249 IP srs-server.8000 > 91.149.66.16.9728: UDP, length 34
12:50:10.860510 IP 91.149.66.16.9728 > srs-server.8000: UDP, length 105
12:50:10.890417 IP 91.149.66.16.9728 > srs-server.8000: UDP, length 101
12:50:10.890498 IP 91.149.66.16.9728 > srs-server.8000: UDP, length 102
12:50:10.930544 IP 91.149.66.16.9728 > srs-server.8000: UDP, length 104
12:50:10.930677 IP 91.149.66.16.9728 > srs-server.8000: UDP, length 1005
12:50:10.931696 IP 91.149.66.16.9728 > srs-server.8000: UDP, length 1006
12:50:10.931696 IP 91.149.66.16.9728 > srs-server.8000: UDP, length 103
12:50:10.939288 IP srs-server.8000 > 91.149.66.16.9728: UDP, length 46
12:50:10.970403 IP 91.149.66.16.9728 > srs-server.8000: UDP, length 105
12:50:10.970403 IP 91.149.66.16.9728 > srs-server.8000: UDP, length 100
12:50:11.010327 IP 91.149.66.16.9728 > srs-server.8000: UDP, length 104
12:50:11.010327 IP 91.149.66.16.9728 > srs-server.8000: UDP, length 107
12:50:11.039655 IP srs-server.8000 > 91.149.66.16.9728: UDP, length 42
12:50:11.040571 IP 91.149.66.16.9728 > srs-server.8000: UDP, length 1047
12:50:11.041614 IP 91.149.66.16.9728 > srs-server.8000: UDP, length 1047
12:50:11.041614 IP 91.149.66.16.9728 > srs-server.8000: UDP, length 110
12:50:11.041614 IP 91.149.66.16.9728 > srs-server.8000: UDP, length 108
12:50:11.083562 IP 91.149.66.16.9728 > srs-server.8000: UDP, length 105
12:50:11.090319 IP 91.149.66.16.9728 > srs-server.8000: UDP, length 102
12:50:11.130562 IP 91.149.66.16.9728 > srs-server.8000: UDP, length 103
12:50:11.130562 IP 91.149.66.16.9728 > srs-server.8000: UDP, length 104
12:50:11.130598 IP 91.149.66.16.9728 > srs-server.8000: UDP, length 1043
12:50:11.131480 IP 91.149.66.16.9728 > srs-server.8000: UDP, length 1044
12:50:11.140203 IP srs-server.8000 > 91.149.66.16.9728: UDP, length 46
12:50:11.170586 IP 91.149.66.16.9728 > srs-server.8000: UDP, length 107
12:50:11.170586 IP 91.149.66.16.9728 > srs-server.8000: UDP, length 112
12:50:11.210490 IP 91.149.66.16.9728 > srs-server.8000: UDP, length 105
12:50:11.210491 IP 91.149.66.16.9728 > srs-server.8000: UDP, length 100
12:50:11.240777 IP srs-server.8000 > 91.149.66.16.9728: UDP, length 42
12:50:11.243442 IP 91.149.66.16.9728 > srs-server.8000: UDP, length 1090
12:50:11.244584 IP 91.149.66.16.9728 > srs-server.8000: UDP, length 1091
12:50:11.244651 IP 91.149.66.16.9728 > srs-server.8000: UDP, length 104
12:50:11.244651 IP 91.149.66.16.9728 > srs-server.8000: UDP, length 104
12:50:11.283373 IP 91.149.66.16.9728 > srs-server.8000: UDP, length 103
12:50:11.290349 IP 91.149.66.16.9728 > srs-server.8000: UDP, length 105
12:50:11.331731 IP 91.149.66.16.9728 > srs-server.8000: UDP, length 1101
12:50:11.332758 IP 91.149.66.16.9728 > srs-server.8000: UDP, length 1102
12:50:11.332758 IP 91.149.66.16.9728 > srs-server.8000: UDP, length 100
12:50:11.332758 IP 91.149.66.16.9728 > srs-server.8000: UDP, length 97
12:50:11.341450 IP srs-server.8000 > 91.149.66.16.9728: UDP, length 46
12:50:11.363394 IP 91.149.66.16.9728 > srs-server.8000: UDP, length 99
12:50:11.370456 IP 91.149.66.16.9728 > srs-server.8000: UDP, length 103
12:50:11.403495 IP 91.149.66.16.9728 > srs-server.8000: UDP, length 100
12:50:11.410629 IP 91.149.66.16.9728 > srs-server.8000: UDP, length 94
12:50:11.425757 IP 91.149.66.16.9728 > srs-server.8000: UDP, length 1064
12:50:11.426531 IP 91.149.66.16.9728 > srs-server.8000: UDP, length 1065
12:50:11.435421 IP 91.149.66.16.9728 > srs-server.8000: UDP, length 105
12:50:11.441744 IP srs-server.8000 > 91.149.66.16.9728: UDP, length 46
12:50:11.442495 IP 91.149.66.16.9728 > srs-server.8000: UDP, length 105
12:50:11.490375 IP 91.149.66.16.9728 > srs-server.8000: UDP, length 106
12:50:11.490375 IP 91.149.66.16.9728 > srs-server.8000: UDP, length 96
12:50:11.490401 IP 91.149.66.16.9728 > srs-server.8000: UDP, length 95
12:50:11.523404 IP 91.149.66.16.9728 > srs-server.8000: UDP, length 88
12:50:11.530533 IP 91.149.66.16.9728 > srs-server.8000: UDP, length 97
12:50:11.531554 IP 91.149.66.16.9728 > srs-server.8000: UDP, length 1110
12:50:11.533620 IP 91.149.66.16.9728 > srs-server.8000: UDP, length 1111
12:50:11.541901 IP srs-server.8000 > 91.149.66.16.9728: UDP, length 46
12:50:11.590205 IP 91.149.66.16.9728 > srs-server.8000: UDP, length 88
12:50:11.590205 IP 91.149.66.16.9728 > srs-server.8000: UDP, length 91
12:50:11.605546 IP 91.149.66.16.9728 > srs-server.8000: UDP, length 88
12:50:11.605546 IP 91.149.66.16.9728 > srs-server.8000: UDP, length 86
12:50:11.622494 IP 91.149.66.16.9728 > srs-server.8000: UDP, length 1064
12:50:11.639545 IP 91.149.66.16.9728 > srs-server.8000: UDP, length 1064
12:50:11.639545 IP 91.149.66.16.9728 > srs-server.8000: UDP, length 84
12:50:11.642895 IP srs-server.8000 > 91.149.66.16.9728: UDP, length 46
12:50:11.647510 IP 91.149.66.16.9728 > srs-server.8000: UDP, length 90
12:50:11.690229 IP 91.149.66.16.9728 > srs-server.8000: UDP, length 90
12:50:11.690325 IP 91.149.66.16.9728 > srs-server.8000: UDP, length 95
12:50:11.731425 IP 91.149.66.16.9728 > srs-server.8000: UDP, length 101
12:50:11.731425 IP 91.149.66.16.9728 > srs-server.8000: UDP, length 107
12:50:11.732581 IP 91.149.66.16.9728 > srs-server.8000: UDP, length 1100
12:50:11.734826 IP 91.149.66.16.9728 > srs-server.8000: UDP, length 1101
12:50:11.743566 IP srs-server.8000 > 91.149.66.16.9728: UDP, length 46
12:50:11.743613 IP srs-server.8000 > 91.149.66.16.9728: UDP, length 26
12:50:11.757439 IP 91.149.66.16.9728 > srs-server.8000: UDP, length 103
12:50:11.772487 IP 91.149.66.16.9728 > srs-server.8000: UDP, length 99
12:50:11.803487 IP 91.149.66.16.9728 > srs-server.8000: UDP, length 97
12:50:11.804435 IP 91.149.66.16.9728 > srs-server.8000: UDP, length 97
12:50:11.831655 IP 91.149.66.16.9728 > srs-server.8000: UDP, length 1025
12:50:11.832456 IP 91.149.66.16.9728 > srs-server.8000: UDP, length 1026
12:50:11.844380 IP srs-server.8000 > 91.149.66.16.9728: UDP, length 42
12:50:11.847437 IP 91.149.66.16.9728 > srs-server.8000: UDP, length 96
12:50:11.847437 IP 91.149.66.16.9728 > srs-server.8000: UDP, length 92
12:50:11.847740 IP srs-server.8000 > 91.149.66.16.9728: UDP, length 46
12:50:11.847750 IP srs-server.8000 > 91.149.66.16.9728: UDP, length 46
12:50:11.847760 IP srs-server.8000 > 91.149.66.16.9728: UDP, length 34
12:50:11.847770 IP srs-server.8000 > 91.149.66.16.9728: UDP, length 34
12:50:11.891452 IP 91.149.66.16.9728 > srs-server.8000: UDP, length 87
12:50:11.891452 IP 91.149.66.16.9728 > srs-server.8000: UDP, length 87
12:50:11.930555 IP 91.149.66.16.9728 > srs-server.8000: UDP, length 85
12:50:11.930555 IP 91.149.66.16.9728 > srs-server.8000: UDP, length 87
12:50:11.930555 IP 91.149.66.16.9728 > srs-server.8000: UDP, length 57
12:50:11.931516 IP 91.149.66.16.9728 > srs-server.8000: UDP, length 1158
12:50:11.933571 IP 91.149.66.16.9728 > srs-server.8000: UDP, length 1159
12:50:11.934810 IP 91.149.66.16.9728 > srs-server.8000: UDP, length 1159
12:50:11.945372 IP srs-server.8000 > 91.149.66.16.9728: UDP, length 46
12:50:11.970496 IP 91.149.66.16.9728 > srs-server.8000: UDP, length 86
12:50:11.970496 IP 91.149.66.16.9728 > srs-server.8000: UDP, length 91
12:50:12.010493 IP 91.149.66.16.9728 > srs-server.8000: UDP, length 94
12:50:12.010493 IP 91.149.66.16.9728 > srs-server.8000: UDP, length 92
12:50:12.025592 IP 91.149.66.16.9728 > srs-server.8000: UDP, length 824
12:50:12.041523 IP 91.149.66.16.9728 > srs-server.8000: UDP, length 824
12:50:12.042779 IP 91.149.66.16.9728 > srs-server.8000: UDP, length 825
12:50:12.042779 IP 91.149.66.16.9728 > srs-server.8000: UDP, length 98
12:50:12.042779 IP 91.149.66.16.9728 > srs-server.8000: UDP, length 96
12:50:12.045557 IP srs-server.8000 > 91.149.66.16.9728: UDP, length 46
12:50:12.090328 IP 91.149.66.16.9728 > srs-server.8000: UDP, length 89
12:50:12.090328 IP 91.149.66.16.9728 > srs-server.8000: UDP, length 96
12:50:12.136715 IP 91.149.66.16.9728 > srs-server.8000: UDP, length 1032
12:50:12.138702 IP 91.149.66.16.9728 > srs-server.8000: UDP, length 1033
12:50:12.138931 IP 91.149.66.16.9728 > srs-server.8000: UDP, length 93
12:50:12.138931 IP 91.149.66.16.9728 > srs-server.8000: UDP, length 94
12:50:12.145688 IP srs-server.8000 > 91.149.66.16.9728: UDP, length 42
12:50:12.170474 IP 91.149.66.16.9728 > srs-server.8000: UDP, length 91
12:50:12.170561 IP 91.149.66.16.9728 > srs-server.8000: UDP, length 85
12:50:12.210525 IP 91.149.66.16.9728 > srs-server.8000: UDP, length 84
12:50:12.210525 IP 91.149.66.16.9728 > srs-server.8000: UDP, length 85
12:50:12.225603 IP 91.149.66.16.9728 > srs-server.8000: UDP, length 1055
12:50:12.226473 IP 91.149.66.16.9728 > srs-server.8000: UDP, length 1055
12:50:12.242443 IP 91.149.66.16.9728 > srs-server.8000: UDP, length 84
12:50:12.242443 IP 91.149.66.16.9728 > srs-server.8000: UDP, length 81
12:50:12.245992 IP srs-server.8000 > 91.149.66.16.9728: UDP, length 46
12:50:12.290386 IP 91.149.66.16.9728 > srs-server.8000: UDP, length 81
12:50:12.290386 IP 91.149.66.16.9728 > srs-server.8000: UDP, length 90
12:50:12.330589 IP 91.149.66.16.9728 > srs-server.8000: UDP, length 104
12:50:12.330589 IP 91.149.66.16.9728 > srs-server.8000: UDP, length 91
12:50:12.330589 IP 91.149.66.16.9728 > srs-server.8000: UDP, length 92
12:50:12.330759 IP srs-server.8000 > 91.149.66.16.9728: UDP, length 84
12:50:12.331588 IP 91.149.66.16.9728 > srs-server.8000: UDP, length 990
12:50:12.332432 IP 91.149.66.16.9728 > srs-server.8000: UDP, length 991
12:50:12.348253 IP srs-server.8000 > 91.149.66.16.9728: UDP, length 42
12:50:12.370252 IP 91.149.66.16.9728 > srs-server.8000: UDP, length 90
12:50:12.370252 IP 91.149.66.16.9728 > srs-server.8000: UDP, length 94
12:50:12.410513 IP 91.149.66.16.9728 > srs-server.8000: UDP, length 94
12:50:12.410513 IP 91.149.66.16.9728 > srs-server.8000: UDP, length 88
12:50:12.440713 IP 91.149.66.16.9728 > srs-server.8000: UDP, length 1038
12:50:12.441619 IP 91.149.66.16.9728 > srs-server.8000: UDP, length 1038
12:50:12.441619 IP 91.149.66.16.9728 > srs-server.8000: UDP, length 89
12:50:12.441619 IP 91.149.66.16.9728 > srs-server.8000: UDP, length 91
12:50:12.448735 IP srs-server.8000 > 91.149.66.16.9728: UDP, length 46
12:50:12.490365 IP 91.149.66.16.9728 > srs-server.8000: UDP, length 83
12:50:12.490365 IP 91.149.66.16.9728 > srs-server.8000: UDP, length 85
12:50:12.530578 IP 91.149.66.16.9728 > srs-server.8000: UDP, length 85
12:50:12.530605 IP 91.149.66.16.9728 > srs-server.8000: UDP, length 87
12:50:12.530605 IP 91.149.66.16.9728 > srs-server.8000: UDP, length 986
12:50:12.531757 IP 91.149.66.16.9728 > srs-server.8000: UDP, length 987
12:50:12.548807 IP srs-server.8000 > 91.149.66.16.9728: UDP, length 42
12:50:12.570390 IP 91.149.66.16.9728 > srs-server.8000: UDP, length 83
12:50:12.570425 IP 91.149.66.16.9728 > srs-server.8000: UDP, length 87
12:50:12.610451 IP 91.149.66.16.9728 > srs-server.8000: UDP, length 81
12:50:12.610451 IP 91.149.66.16.9728 > srs-server.8000: UDP, length 82
12:50:12.641588 IP 91.149.66.16.9728 > srs-server.8000: UDP, length 968
12:50:12.642741 IP 91.149.66.16.9728 > srs-server.8000: UDP, length 969
12:50:12.642741 IP 91.149.66.16.9728 > srs-server.8000: UDP, length 85
12:50:12.642741 IP 91.149.66.16.9728 > srs-server.8000: UDP, length 92
12:50:12.651014 IP srs-server.8000 > 91.149.66.16.9728: UDP, length 46
12:50:12.683275 IP 91.149.66.16.9728 > srs-server.8000: UDP, length 88
12:50:12.690378 IP 91.149.66.16.9728 > srs-server.8000: UDP, length 84
12:50:12.723251 IP 91.149.66.16.9728 > srs-server.8000: UDP, length 85
12:50:12.730323 IP 91.149.66.16.9728 > srs-server.8000: UDP, length 85
12:50:12.751093 IP srs-server.8000 > 91.149.66.16.9728: UDP, length 42
12:50:12.753531 IP 91.149.66.16.9728 > srs-server.8000: UDP, length 987
12:50:12.754684 IP 91.149.66.16.9728 > srs-server.8000: UDP, length 988
12:50:12.754684 IP 91.149.66.16.9728 > srs-server.8000: UDP, length 84
12:50:12.754684 IP 91.149.66.16.9728 > srs-server.8000: UDP, length 81
12:50:12.803324 IP 91.149.66.16.9728 > srs-server.8000: UDP, length 82
12:50:12.810405 IP 91.149.66.16.9728 > srs-server.8000: UDP, length 86
12:50:12.851355 IP srs-server.8000 > 91.149.66.16.9728: UDP, length 42
12:50:12.851381 IP srs-server.8000 > 91.149.66.16.9728: UDP, length 46
12:50:12.851402 IP srs-server.8000 > 91.149.66.16.9728: UDP, length 46
12:50:12.851422 IP srs-server.8000 > 91.149.66.16.9728: UDP, length 34
12:50:12.851443 IP srs-server.8000 > 91.149.66.16.9728: UDP, length 34
12:50:12.858535 IP 91.149.66.16.9728 > srs-server.8000: UDP, length 1081
12:50:12.859901 IP 91.149.66.16.9728 > srs-server.8000: UDP, length 1082
12:50:12.859901 IP 91.149.66.16.9728 > srs-server.8000: UDP, length 88
12:50:12.859901 IP 91.149.66.16.9728 > srs-server.8000: UDP, length 83
12:50:12.872786 IP 91.149.66.16.9728 > srs-server.8000: UDP, length 89
12:50:12.873462 IP 91.149.66.16.9728 > srs-server.8000: UDP, length 85
12:50:12.923340 IP 91.149.66.16.9728 > srs-server.8000: UDP, length 87
12:50:12.930507 IP 91.149.66.16.9728 > srs-server.8000: UDP, length 90
12:50:12.930507 IP 91.149.66.16.9728 > srs-server.8000: UDP, length 106
12:50:12.931834 IP 91.149.66.16.9728 > srs-server.8000: UDP, length 1085
12:50:12.931863 IP 91.149.66.16.9728 > srs-server.8000: UDP, length 1085
12:50:12.952339 IP srs-server.8000 > 91.149.66.16.9728: UDP, length 46
12:50:12.963348 IP 91.149.66.16.9728 > srs-server.8000: UDP, length 88
12:50:12.970474 IP 91.149.66.16.9728 > srs-server.8000: UDP, length 82
12:50:13.010475 IP 91.149.66.16.9728 > srs-server.8000: UDP, length 91
12:50:13.010475 IP 91.149.66.16.9728 > srs-server.8000: UDP, length 110
12:50:13.041561 IP 91.149.66.16.9728 > srs-server.8000: UDP, length 1007
12:50:13.042542 IP 91.149.66.16.9728 > srs-server.8000: UDP, length 1007
12:50:13.042542 IP 91.149.66.16.9728 > srs-server.8000: UDP, length 110
12:50:13.042542 IP 91.149.66.16.9728 > srs-server.8000: UDP, length 110
12:50:13.053232 IP srs-server.8000 > 91.149.66.16.9728: UDP, length 46
12:50:13.090342 IP 91.149.66.16.9728 > srs-server.8000: UDP, length 113
12:50:13.090342 IP 91.149.66.16.9728 > srs-server.8000: UDP, length 107
12:50:13.130656 IP 91.149.66.16.9728 > srs-server.8000: UDP, length 103
12:50:13.130656 IP 91.149.66.16.9728 > srs-server.8000: UDP, length 114
12:50:13.131929 IP 91.149.66.16.9728 > srs-server.8000: UDP, length 999
12:50:13.131929 IP 91.149.66.16.9728 > srs-server.8000: UDP, length 999
12:50:13.154274 IP srs-server.8000 > 91.149.66.16.9728: UDP, length 42
12:50:13.170429 IP 91.149.66.16.9728 > srs-server.8000: UDP, length 106
12:50:13.170429 IP 91.149.66.16.9728 > srs-server.8000: UDP, length 108
12:50:13.210440 IP 91.149.66.16.9728 > srs-server.8000: UDP, length 101
12:50:13.210440 IP 91.149.66.16.9728 > srs-server.8000: UDP, length 108
12:50:13.225575 IP 91.149.66.16.9728 > srs-server.8000: UDP, length 1044
12:50:13.240629 IP 91.149.66.16.9728 > srs-server.8000: UDP, length 1044
